{"$schema":"https://json-schema.org/draft/2020-12/schema","$id":"xdebug.stream.show.response.v1","title":"stream.show response","type":"object","required":["api_version","ok","action","summary","data"],"properties":{"api_version":{"type":"string","enum":["xdebug.v1"]},"ok":{"type":"boolean"},"action":{"type":"string","enum":["stream.show"]},"summary":{"type":"object"},"data":{"type":"object"},"error":{},"warnings":{"type":"array"},"meta":{"type":"object"}},"additionalProperties":true}
