{
  "api_version": "xdebug.v1",
  "ok": true,
  "action": "stream.show",
  "summary": {
    "stream": "req_stream",
    "handshake": "vld/rdy",
    "packet_enabled": true
  },
  "data": {
    "config": {
      "name": "req_stream",
      "clock": "top.clk",
      "edge": "posedge",
      "vld": "top.req_vld",
      "rdy": "top.req_rdy"
    },
    "issues": []
  }
}
